{
  "button": {
    "AddCredit": "Добавить\nКредит"
  },
  "error": {
    "SomePlanChangedWasNotSaved": "Некоторые изменения не удалось сохранить из-за ошибок."
  },
  "form": {
    "hint": {
      "Duration": "Месяцев",
      "FeeFromSyncAccountsAll": "Автоматические платежи не будут работать для синхронизированных счетов.",
      "FeeFromSyncAccountsSome": "Автоматические платежи не будут работать для синхронизированных счетов."
    },
    "label": {
      "Duration": "Срок",
      "EndDate": "Дата окончания",
      "FeeFromAccounts": "Выплачивать автоматически со счетов",
      "Name": "Название",
      "OnlyCurrency": "Не зачислять на счёт",
      "PlanType": "Тип выплат",
      "Rate": "Ставка",
      "ReceiveCreditToAccount": "Зачислить на счёт",
      "RemainToFee": "Осталось выплатить",
      "StartDate": "Дата начала",
      "TotalCreditAmount": "Полученная сумма",
      "TotalPayAmount": "Общая сумма выплат"
    },
    "planType": {
      "Ann": "Аннуитетный",
      "Diff": "Дифференцированный"
    },
    "title": {
      "CreateCredit": "Добавить кредит",
      "EditCredit": "Изменить кредит"
    }
  },
  "formOperation": {
    "label": {
      "DealWithAccounts": "Влияет на остатки на счетах",
      "LinkToPlan": "Привязать к графику",
      "LinkToPlanItem": "{date}: {paid} {ofTotal} ({percent}%)",
      "NoLinkToPlan": "вне плана",
      "SelectTransaction": "Выберите транзакцию...",
      "TransactionLinked": "Привязана транзакция на {amount} за {date}{ifAccountValid, select, 0{ по другому счёту} other{}}",
      "TransactionNotLinked": "Транзакция не привязана"
    },
    "message": {
      "SelectTransaction": "Укажите транзакцию.",
      "TransactionFetchFailed": "Не удалось получить детали по выбранной транзакции."
    }
  },
  "formPlan": {
    "label": {
      "PaidAmount": "Выплачено"
    },
    "title": {
      "CreatePlan": "Создать календарь выплат",
      "EditPlan": "Изменить календарь выплат"
    }
  },
  "page": {
    "state": {
      "Completed": "Выплаченные",
      "Pending": "Актуальные"
    },
    "Title": "Кредиты"
  },
  "pageItem": {
    "button": {
      "DeleteKeepTransaction": "Удалить, но оставить транзакцию",
      "DeleteWithTransaction": "Удалить вместе с транзакцией",
      "Finish": "Завершить",
      "PayNow": "Заплатить сейчас",
      "UndoFinish": "Отменить завершение"
    },
    "label": {
      "AlreadyPaidAmount": "Выплачено",
      "CreatePayCalendar": "Создать календарь выплат",
      "NextPayment": "Следующий платёж",
      "ViewPayCalendar": "Посмотреть календарь выплат"
    },
    "message": {
      "ConfirmDelete": "Вы уверены, что хотите удалить кредитную операцию? Это не затронет остатки на счетах.",
      "ConfirmDeleteMayKeepTransaction": "Эта кредитная операция связана с транзакцией. При удалении этой кредитной операции вы можете как оставить транзакцию, так и удалить её.",
      "ConfirmFinish": "Завершить кредит?",
      "ConfirmUndoFinish": "Отменить завершение кредита?",
      "DeleteConfirm": "Вы уверены, что хотите удалить этот кредит?"
    },
    "title": {
      "DeleteCredit": "Удаление Кредита",
      "Operations": "История операций",
      "PaymentsChart": "График платежей"
    }
  }
}
