{
  "button": {
    "AddCredit": "Add\nCredit"
  },
  "error": {
    "SomePlanChangedWasNotSaved": "Some changes was not saved due to errors."
  },
  "form": {
    "hint": {
      "Duration": "Months",
      "FeeFromSyncAccountsAll": "Automated payment will not work with synchronized accounts.",
      "FeeFromSyncAccountsSome": "Automated payment will not work with synchronized accounts."
    },
    "label": {
      "Duration": "Duration",
      "EndDate": "End date",
      "FeeFromAccounts": "Pay automatically from accounts",
      "Name": "Name",
      "OnlyCurrency": "Don't add to account",
      "PlanType": "Plan type",
      "Rate": "Rate",
      "ReceiveCreditToAccount": "Receive credit to account",
      "RemainToFee": "Remain to fee",
      "StartDate": "Start date",
      "TotalCreditAmount": "Total credit amount",
      "TotalPayAmount": "Total pay amount"
    },
    "planType": {
      "Ann": "Annuity",
      "Diff": "Differential"
    },
    "title": {
      "CreateCredit": "Add credit",
      "EditCredit": "Edit credit"
    }
  },
  "formOperation": {
    "label": {
      "DealWithAccounts": "Does affect accounts",
      "LinkToPlan": "Link to plan",
      "LinkToPlanItem": "{date}: {paid} {ofTotal} ({percent}%)",
      "NoLinkToPlan": "out of plan",
      "SelectTransaction": "Select transaction...",
      "TransactionLinked": "Linked transaction for {amount} at {date}{ifAccountValid, select, 0{ with another account} other{}}",
      "TransactionNotLinked": "No transaction linked"
    },
    "message": {
      "SelectTransaction": "Please, select transaction.",
      "TransactionFetchFailed": "Could not fetch details for linked transaction."
    }
  },
  "formPlan": {
    "label": {
      "PaidAmount": "Paid"
    },
    "title": {
      "CreatePlan": "Create plan",
      "EditPlan": "Edit plan"
    }
  },
  "page": {
    "state": {
      "Completed": "Finished",
      "Pending": "Actual"
    },
    "Title": "Credits"
  },
  "pageItem": {
    "button": {
      "DeleteKeepTransaction": "Delete operation, keep transactions",
      "DeleteWithTransaction": "Delete WITH transaction",
      "Finish": "Complete",
      "PayNow": "Pay now",
      "UndoFinish": "Cancel completion"
    },
    "label": {
      "AlreadyPaidAmount": "Already paid",
      "CreatePayCalendar": "Create payments plan",
      "NextPayment": "Next payment",
      "ViewPayCalendar": "View payments plan"
    },
    "message": {
      "ConfirmDelete": "Are you sure to delete this credit operation? This action will not change accounts balance.",
      "ConfirmDeleteMayKeepTransaction": "This credit operation is linked with transaction. You can keep the transaction or delete it too while deleting credit operation.",
      "ConfirmFinish": "Complete credit?",
      "ConfirmUndoFinish": "Cancel credit completion?",
      "DeleteConfirm": "Are you sure to delete this credit completely?"
    },
    "title": {
      "DeleteCredit": "Deleting Credit",
      "Operations": "Operations history",
      "PaymentsChart": "Payments chart"
    }
  }
}
