{
  "button": {
    "AddCredit": "Προσθήκη\nΠιστωτική"
  },
  "error": {
    "SomePlanChangedWasNotSaved": "Ορισμένες αλλαγές δεν ήταν δυνατό να αποθηκευτούν λόγω σφαλμάτων."
  },
  "form": {
    "hint": {
      "Duration": "Μήνες",
      "FeeFromSyncAccountsAll": "Οι αυτόματες πληρωμές δεν θα λειτουργούν για συγχρονισμένους λογαριασμούς.",
      "FeeFromSyncAccountsSome": "Οι αυτόματες πληρωμές δεν θα λειτουργούν για συγχρονισμένους λογαριασμούς."
    },
    "label": {
      "Duration": "Ορος",
      "EndDate": "ημερομηνία λήξης",
      "FeeFromAccounts": "Πληρώστε αυτόματα από λογαριασμούς",
      "Name": "Ονομα",
      "OnlyCurrency": "Μην πιστώσετε",
      "PlanType": "Τρόπος πληρωμής",
      "Rate": "Προσφορά",
      "ReceiveCreditToAccount": "Πίστωση σε λογαριασμό",
      "RemainToFee": "Μένει να πληρώσει",
      "StartDate": "ημερομηνία έναρξης",
      "TotalCreditAmount": "Ποσό που έχει εισπραχθεί",
      "TotalPayAmount": "Συνολικές πληρωμές"
    },
    "planType": {
      "Ann": "Πρόσοδος",
      "Diff": "Διαφοροποιημένο"
    },
    "title": {
      "CreateCredit": "Προσθέστε πίστωση",
      "EditCredit": "Αλλαγή δανείου"
    }
  },
  "formOperation": {
    "label": {
      "DealWithAccounts": "Επηρεάζει τα υπόλοιπα λογαριασμών",
      "LinkToPlan": "Κλείστε στο γράφημα",
      "LinkToPlanItem": "{date}: {paid} {ofTotal} ({percent}%)",
      "NoLinkToPlan": "εκτός σχεδίου",
      "SelectTransaction": "Επιλέξτε μια συναλλαγή...",
      "TransactionLinked": "Δεσμευμένη συναλλαγή για {amount} για {date}{ifAccountValid, select, 0{ σε άλλο λογαριασμό} other{}}",
      "TransactionNotLinked": "Η συναλλαγή δεν είναι δεσμευμένη"
    },
    "message": {
      "SelectTransaction": "Καθορίστε τη συναλλαγή.",
      "TransactionFetchFailed": "Αποτυχία λήψης λεπτομερειών για την επιλεγμένη συναλλαγή."
    }
  },
  "formPlan": {
    "label": {
      "PaidAmount": "Εξοφλήθηκε"
    },
    "title": {
      "CreatePlan": "Δημιουργήστε ένα ημερολόγιο πληρωμής",
      "EditPlan": "Αλλάξτε το ημερολόγιο πληρωμής"
    }
  },
  "page": {
    "state": {
      "Completed": "Εξοφλήθηκε",
      "Pending": "Τοπικός"
    },
    "Title": "Δάνεια"
  },
  "pageItem": {
    "button": {
      "DeleteKeepTransaction": "Διαγραφή αλλά διατήρηση της συναλλαγής",
      "DeleteWithTransaction": "Διαγραφή μαζί με τη συναλλαγή",
      "Finish": "Ολοκληρώθηκε",
      "PayNow": "Πλήρωσε τώρα",
      "UndoFinish": "Ακύρωση ολοκλήρωσης"
    },
    "label": {
      "AlreadyPaidAmount": "Εξοφλήθηκε",
      "CreatePayCalendar": "Δημιουργήστε ένα ημερολόγιο πληρωμής",
      "NextPayment": "Επόμενη πληρωμή",
      "ViewPayCalendar": "Προβολή ημερολογίου πληρωμής"
    },
    "message": {
      "ConfirmDelete": "Είστε βέβαιοι ότι θέλετε να διαγράψετε τη συναλλαγή πίστωσης; Τα υπόλοιπα λογαριασμών δεν θα επηρεαστούν.",
      "ConfirmDeleteMayKeepTransaction": "Αυτή η συναλλαγή πίστωσης σχετίζεται με μια συναλλαγή. Κατά τη διαγραφή αυτής της πιστωτικής λειτουργίας, μπορείτε είτε να αποχωρήσετε από τη συναλλαγή είτε να τη διαγράψετε.",
      "ConfirmFinish": "Ολοκληρώθηκε πίστωσης?",
      "ConfirmUndoFinish": "Ακύρωση ολοκλήρωσης πίστωσης?",
      "DeleteConfirm": "Είστε βέβαιοι ότι θέλετε να διαγράψετε αυτό το δάνειο;"
    },
    "title": {
      "DeleteCredit": "Κατάργηση πίστωσης",
      "Operations": "Ιστορικό λειτουργιών",
      "PaymentsChart": "ΠΡΟΓΡΑΜΜΑ ΠΛΗΡΩΜΩΝ"
    }
  }
}
